{
  "release_manifest_version": "foigent.protocol-release-manifest.v2",
  "protocol_version": "2.0.0",
  "authority": {
    "repository": "https://github.com/foigent/event-connector-spec",
    "repository_id": 1313391565,
    "tag": "v2.0.0"
  },
  "predecessor": {
    "protocol_version": "1.1.2",
    "tag": "v1.1.2",
    "tag_commit": "fd82aeca9877bea8064b25c365a3cdcdd0bb3d16",
    "tree": "d316d6ada678066ed7679a772856aea6157d869d",
    "content_digest": "sha256:da5b1bf863aa467a64771b5236bb916b96c73c4043ed347c44eafb03d8682813",
    "release_digest": "sha256:0b414d5d59e5a7ca5c05505cb58d7992c544537da1c84a57256ec205618d9cd1"
  },
  "boundary": {
    "product_adoption": "not_authorized",
    "runtime_mutation": "none"
  },
  "components": {
    "authority_readme": {
      "path": "README.md",
      "sha256": "sha256:91a651e1b423b2d7d797d4edc9be06c317bc40cd1064ca71cb0a705acca2b472"
    },
    "governance": {
      "path": "GOVERNANCE.md",
      "sha256": "sha256:902abe2582c8ec7dde4db0f0af67016878135b7e233fd8bdbc4dde1e80ec8ba4"
    },
    "release_decision": {
      "path": "docs/decisions/0003-protocol-v2-release.md",
      "sha256": "sha256:dc1486ee1efd35e2c20161c387551daa7e84c756f6ed37b51a92f8e304740d53"
    },
    "predecessor_release_manifest": {
      "path": "releases/v1.1.2/release-manifest.json",
      "sha256": "sha256:e7637eb3162e4076f991588c54cbeb083bcf39d8795587c2594ea45940a9b750"
    },
    "candidate_manifest_archive": {
      "path": "docs/candidates/v2.0.0-rc.1/candidate-manifest.json",
      "sha256": "sha256:ee046d1e06cbb3ab98a8565737ecd76ce71423be68e22d6f4f7b916ffcbb4b91"
    },
    "candidate_source_owner_review": {
      "path": "reviews/candidates/v2.0.0-rc.1/source-owner-review.md",
      "sha256": "sha256:f09ab63b939ed0595c1ba2877856038acc2edd3c4129f09da169293288907582"
    },
    "candidate_projection_owner_review": {
      "path": "reviews/candidates/v2.0.0-rc.1/projection-owner-review.md",
      "sha256": "sha256:56c50149c70758b2df3f029934a45b6185cf2fd2bba7b916420ecb53c0941e9a"
    },
    "candidate_coordinator_review": {
      "path": "reviews/candidates/v2.0.0-rc.1/coordinator-review.md",
      "sha256": "sha256:a80a7a3fa111923c35bac9a3d299bb66c31f035b93cbcd8373bbe773221d1cd8"
    },
    "protocol_spec": {
      "path": "spec/protocol-v2.md",
      "sha256": "sha256:4a8efd02b07c29f4ce19fb30bd5fa9f256254ba6cfe92420bf8e6a268b22702d"
    },
    "protocol_v1_compatibility_base": {
      "path": "spec/protocol-v1.md",
      "sha256": "sha256:56e0bf210f110839403ab653936ffc9fb41236b39846f697d8536c816ed2c45f"
    },
    "shared_ci_action": {
      "path": "actions/source-neutral-v2/action.yml",
      "sha256": "sha256:dd8a475e1127872858876388231f74fec4fa1d249499133eca83c6b47a58711c"
    },
    "authority_ci_workflow": {
      "path": ".github/workflows/source-neutral-v2.yml",
      "sha256": "sha256:081dec8c2b8ad71b69a695c581c94fe4848e0f59fe1aa3780ade41ce6dbe70d3"
    },
    "legacy_conformance_kit": {
      "path": "scripts/run-conformance-kit.sh",
      "sha256": "sha256:98afa5b6c964df78a80a7aaf7488899f76d21123f0f867ab3a83fc6af9a43214"
    },
    "predecessor_conformance_kit": {
      "path": "scripts/run-v1.1.2-predecessor-kit.sh",
      "sha256": "sha256:bd1f8dbb794e7ac65a316c98e90d8fe4d7d57110dff605ee1bfcf353ba0d2cd9"
    },
    "v1_compatibility_kit": {
      "path": "scripts/run-v1-compatibility-kit.sh",
      "sha256": "sha256:7b17a869aa0c6c420c84d68b85abe6c2f8555960f3b24020902eab771b9f7cab"
    },
    "conformance_kit_runner": {
      "path": "scripts/run-source-neutral-v2-release-kit.sh",
      "sha256": "sha256:ca58451dbd15d1c9c6e6daaea010133f1c242b1db3c28207780ee1f44a246c35"
    },
    "legacy_release_builder": {
      "path": "scripts/build-release-manifest.mjs",
      "sha256": "sha256:2a37f17e2ec4abbfc753fba650023b8e8ca8f09307c3a663210efd9a09c34e83"
    },
    "release_builder": {
      "path": "scripts/build-source-neutral-v2-release-manifest.mjs",
      "sha256": "sha256:ff37c3fc2cf8aed5243c74a0697fcda91c44aa610ecfdc7515da24736a726bce"
    },
    "legacy_implementation_manifest_builder": {
      "path": "scripts/build-implementation-manifests.mjs",
      "sha256": "sha256:b171e4e8e7110d0046cebb73347599929e7ff1fa6e2f8b3f9b2be74d158e28f8"
    },
    "legacy_candidate_verifier": {
      "path": "scripts/verify-candidate.mjs",
      "sha256": "sha256:b6b85cf20be7f6cd22c234b17b40b30f899f159ee4b82ad7ecbf0b922d06a78b"
    },
    "legacy_conformance_comparator": {
      "path": "scripts/compare-conformance.mjs",
      "sha256": "sha256:ed20b80680b94e993bec8824514ba3ba752138ec142bf6b84b853c0801df5426"
    },
    "litellm_artifact_builder": {
      "path": "scripts/build-litellm-artifacts.mjs",
      "sha256": "sha256:3975ddf1aacd7c2ad6fac5dad569004b6066b61de6d260ef78b75ec0ad01423e"
    },
    "litellm_upstream_evidence_verifier": {
      "path": "scripts/verify-litellm-upstream-evidence.mjs",
      "sha256": "sha256:c2c58c55640d7eefd36476fad77341489ce2576a9f4ffd2ee766382309eaa32f"
    },
    "litellm_conformance_comparator": {
      "path": "scripts/compare-litellm-conformance.mjs",
      "sha256": "sha256:da30b59e4cd1d46872a66c9cc43f963ac59741a16acc4f16ad7df3079526ed46"
    },
    "source_neutral_artifact_builder": {
      "path": "scripts/build-source-neutral-v2-artifacts.mjs",
      "sha256": "sha256:812fba29c5bc4d11ae3d4154e4844eae26ae403eecdf8f92691ccddf198f6ced"
    },
    "source_neutral_implementation_manifest_builder": {
      "path": "scripts/build-source-neutral-v2-implementation-manifests.mjs",
      "sha256": "sha256:a29fada8d7a6147af94cf9e0ebabe084216754e10a04686cd7acd57716c07ba0"
    },
    "source_neutral_conformance_comparator": {
      "path": "scripts/compare-source-neutral-conformance.mjs",
      "sha256": "sha256:3d21f54fd95aff7859a1d92e74408e5c974f6b9f6e10599242ff066f1c83796f"
    },
    "source_neutral_release_validator": {
      "path": "scripts/validate_source_neutral_v2_release.py",
      "sha256": "sha256:7583e10537757d51b5cad0803bd2f458e141ad8836183dfd6dccc22f40ae26bd"
    },
    "source_neutral_release_tests": {
      "path": "tests/test_source_neutral_v2_release.py",
      "sha256": "sha256:e60c0806e10b891161cea9aa4807b2a65ce05a6d230520d3cadf9d9c01d750bc"
    },
    "candidate_archive_tests": {
      "path": "tests/test_source_neutral_v2_candidate.py",
      "sha256": "sha256:a25e2d37df914675b8cb8d53e890fbd0671527fac1bb02b1a25ed8325840bfc6"
    },
    "product_pin_verifier": {
      "path": "scripts/verify-product-pin-v2.mjs",
      "sha256": "sha256:90208a426a0e4b391e500d8c60eaa11172a0caaece19151a9e9ff404a995b784"
    },
    "release_manifest_v1_schema": {
      "path": "schemas/release-manifest.v1.schema.json",
      "sha256": "sha256:d32190dba69982d02ad0d817a8f0bac9f3e73fe066a25769c36079edd072735c"
    },
    "release_manifest_schema": {
      "path": "schemas/release-manifest.v2.schema.json",
      "sha256": "sha256:b5382c326d69b34f459fa06539682ee098d7cca2928d37e91b0cdb5b5b7e8125"
    },
    "protocol_pin_v1_schema": {
      "path": "schemas/protocol-pin.v1.schema.json",
      "sha256": "sha256:d186f37c5ea7e090f21bb1a6962ec65f07342d60198f35952b0d224e0bc57e60"
    },
    "protocol_pin_schema": {
      "path": "schemas/protocol-pin.v2.schema.json",
      "sha256": "sha256:c4b53efd247dab145d3d9357b5602e90179235e6de83deef7d960fd94b6f9294"
    },
    "event_envelope_schema": {
      "path": "schemas/event-envelope.v1.schema.json",
      "sha256": "sha256:6942e85d9b5d8b08ff9828b970c317596394184ef29908cbf2b8fc792187cf26"
    },
    "capture_gap_schema": {
      "path": "schemas/capture-gap.v1.schema.json",
      "sha256": "sha256:1a5be69da99f62033ceadf05f66d45296d1d5f8b662830f77c0fc6af49edaec8"
    },
    "conformance_report_schema": {
      "path": "schemas/conformance-report.v1.schema.json",
      "sha256": "sha256:42048fbf5a5edc2ca4476727563ab41e96a8fb6d3788d446e0e0d7c4154a31a7"
    },
    "domain_catalog": {
      "path": "catalog/domain-catalog.v2.json",
      "sha256": "sha256:7adfd8210a0dc52e205c714aea0d5e7a26b7617b45cf6e27cbb2ca9d382633fa"
    },
    "connector_manifest_schema": {
      "path": "schemas/connector-manifest.v2.schema.json",
      "sha256": "sha256:ce1e8e84b49e50d0740366e42c64a6899b27834c3cf83116a63a35d3c1a901e5"
    },
    "connector_lifecycle_schema": {
      "path": "schemas/connector-lifecycle.v2.schema.json",
      "sha256": "sha256:b2b8475605fe58e75b97ebe2c6fdab567647757a64112dfeed1b1d4b48afefd0"
    },
    "connector_checkpoint_schema": {
      "path": "schemas/connector-checkpoint.v2.schema.json",
      "sha256": "sha256:80bf1e98b24424a25a14985f36aa179c838363c4deb540c7521b20582eccdd6b"
    },
    "event_batch_schema": {
      "path": "schemas/event-batch.v2.schema.json",
      "sha256": "sha256:36e7da64aa6c33e74e60379274d8426459f1e2ee520e44d0d935fc794b4925da"
    },
    "connector_error_schema": {
      "path": "schemas/connector-error.v2.schema.json",
      "sha256": "sha256:bae3e9a0ee4096feb01655e1f9fc0e4032b3656c0cd0e2a7cad78ec7379a3dee"
    },
    "operational_receipt_schema": {
      "path": "schemas/operational-receipt.v2.schema.json",
      "sha256": "sha256:d2d091c2571d54df7a65329da049f13a4d7465af38b7916e4ae79e57255a04b6"
    },
    "openinference_source_schema": {
      "path": "schemas/openinference-span.v1.schema.json",
      "sha256": "sha256:b5f4da5b586ca4d34af716d52215955c843e5b824f7af7fdbc9a1dfda728b29a"
    },
    "openinference_payload_schema": {
      "path": "schemas/observability-openinference-span-completed.v1.schema.json",
      "sha256": "sha256:b40e06b7ddc0f5c2800aa81c7562f3d79e35074fd9ba692cb663741491e2c0ce"
    },
    "reference_connector_manifest": {
      "path": "manifests/foigent.unirouter.completed-execution-1.0.0.json",
      "sha256": "sha256:a3bc97bd5d5c7aab6452de9518be0b00f62776877deb431a91c175da5287de79"
    },
    "litellm_connector_manifest": {
      "path": "manifests/foigent.litellm.spend-logs-1.0.0.json",